{
  "schema_version": 1,
  "catalog_version": 1,
  "updated_at": "2026-08-19",
  "title": "Harness 功能目录",
  "items": [
    {
      "id": "agent-runtime",
      "parent_id": null,
      "level": "domain",
      "name": "Agent Runtime",
      "summary": "Agent 的生命周期、计划、执行、模型调用和异步编排。",
      "keywords": ["agent", "runtime", "planner", "executor", "run", "模型", "执行"],
      "platforms": ["api", "web", "desktop"],
      "implementation_status": "verified",
      "maturity": "production_candidate",
      "acceptance_criteria": ["Agent Run 能从配置进入可审计的计划与执行链。"],
      "code_paths": ["services/api-server/app/agents", "services/api-server/app/agents/executor.py"],
      "spec_paths": ["docs/architecture/agent-runtime-spec.md", "docs/design/product-spec.md"],
      "test_paths": [],
      "evidence": [],
      "known_gaps": ["正式三平台发布证据仍由 REL-001 跟踪。"],
      "task_ids": ["REL-001"]
    },
    {
      "id": "agent-lifecycle",
      "parent_id": "agent-runtime",
      "level": "capability",
      "name": "Agent 生命周期",
      "summary": "Agent 的创建、配置、克隆和运行入口。",
      "keywords": ["agent studio", "agent lifecycle", "创建 agent", "配置 agent"],
      "platforms": ["api", "web"],
      "implementation_status": "verified",
      "maturity": "production_candidate",
      "acceptance_criteria": ["保存的 Agent 配置可被 Workspace 和 Run 入口读取。"],
      "code_paths": ["services/api-server/app/agents", "apps/agent-console/src/features/agents"],
      "spec_paths": ["docs/design/product-spec.md", "docs/design/features/01-task-lifecycle.md"],
      "test_paths": [],
      "evidence": [],
      "known_gaps": [],
      "task_ids": []
    },
    {
      "id": "agent-definition",
      "parent_id": "agent-lifecycle",
      "level": "feature",
      "name": "Agent 创建与配置",
      "summary": "在 Agent Studio 创建、编辑和保存 Agent 配置。",
      "keywords": ["agent studio", "agent config", "创建", "配置"],
      "platforms": ["api", "web"],
      "implementation_status": "verified",
      "maturity": "production_candidate",
      "acceptance_criteria": ["配置保存后可在 Workspace 创建 Run。", "无效配置被拒绝并显示可诊断错误。"],
      "code_paths": ["services/api-server/app/agents", "apps/agent-console/src/features/agents"],
      "spec_paths": ["docs/design/product-spec.md", "docs/development/ai/stages/02-agent-studio-config.md"],
      "test_paths": ["services/api-server/tests/test_agents.py", "apps/agent-console/src/features/agents/__tests__/AgentListPage.studio.test.tsx"],
      "evidence": [{"kind": "integration", "command": "services/api-server/.venv/bin/python -m pytest tests/test_agents.py", "result": "passed", "verified_at": "2026-08-17", "commit": null, "ref": "docs/development/ai/task-progress.yaml"}],
      "known_gaps": [],
      "task_ids": []
    },
    {
      "id": "agent-run-creation",
      "parent_id": "agent-lifecycle",
      "level": "feature",
      "name": "Agent Run 创建",
      "summary": "从 Workspace 目标创建带有 run/task/trace 关联的 Agent Run。",
      "keywords": ["agent run", "run creation", "workspace run", "创建运行", "任务"],
      "platforms": ["api", "web", "desktop"],
      "implementation_status": "verified",
      "maturity": "production_candidate",
      "acceptance_criteria": ["创建成功后可沿 run、task、trace 关联查看执行证据。"],
      "code_paths": ["services/api-server/app/agents", "apps/agent-console/src/features/agents"],
      "spec_paths": ["docs/development/ai/stages/01-agent-workspace-console.md", "docs/design/features/01-task-lifecycle.md"],
      "test_paths": ["services/api-server/tests/test_agents.py", "scripts/smoke-test-agent-run.py"],
      "evidence": [{"kind": "smoke", "command": "python3 scripts/smoke-test-agent-run.py", "result": "passed", "verified_at": "2026-08-17", "commit": null, "ref": "omx_wiki/deep-interview-private-harness-chain.md"}],
      "known_gaps": [],
      "task_ids": []
    },
    {
      "id": "model-gateway-routing",
      "parent_id": "agent-lifecycle",
      "level": "feature",
      "name": "模型网关与平台模型路由",
      "summary": "通过服务端受控的 OpenAI-compatible provider 和模型 allowlist 完成模型调用。",
      "keywords": ["model gateway", "provider", "deepseek", "model routing", "模型网关"],
      "platforms": ["api", "web", "desktop", "deploy"],
      "implementation_status": "verified",
      "maturity": "production_candidate",
      "acceptance_criteria": ["模型身份、provider 和 allowlist 在服务端校验。", "凭据不进入浏览器或日志。"],
      "code_paths": ["services/api-server/app/agents/model_gateway.py", "services/api-server/app/core/config.py"],
      "spec_paths": ["docs/contracts/api/api-spec.md", "docs/development/ai/reference/runtime-deployment-spec.md"],
      "test_paths": ["services/api-server/tests/test_model_gateway.py", "services/api-server/tests/test_settings.py"],
      "evidence": [{"kind": "integration", "command": "services/api-server/.venv/bin/python -m pytest tests/test_model_gateway.py tests/test_settings.py", "result": "passed", "verified_at": "2026-08-17", "commit": null, "ref": "docs/development/ai/task-progress.yaml"}],
      "known_gaps": ["真实 provider 验证依赖受控凭据和外部服务状态。"],
      "task_ids": []
    },
    {
      "id": "plan-execution",
      "parent_id": "agent-runtime",
      "level": "capability",
      "name": "计划与执行",
      "summary": "Planner、Executor、暂停恢复和异步子 Agent 编排。",
      "keywords": ["plan", "planner", "executor", "pause", "resume", "subagent", "计划", "执行"],
      "platforms": ["api", "web", "desktop"],
      "implementation_status": "verified",
      "maturity": "production_candidate",
      "acceptance_criteria": ["计划、执行和异步工作都写入事件与审计链。"],
      "code_paths": ["services/api-server/app/agents/executor.py", "services/api-server/app/agents"],
      "spec_paths": ["docs/architecture/agent-runtime-spec.md", "docs/design/features/02-planner-executor.md"],
      "test_paths": [],
      "evidence": [],
      "known_gaps": [],
      "task_ids": []
    },
    {
      "id": "planner",
      "parent_id": "plan-execution",
      "level": "feature",
      "name": "Planner 计划生成",
      "summary": "将用户目标转换为可执行的计划和任务依赖。",
      "keywords": ["planner", "plan dag", "计划生成", "任务依赖"],
      "platforms": ["api", "web"],
      "implementation_status": "verified",
      "maturity": "production_candidate",
      "acceptance_criteria": ["计划输出可被 Executor 消费，并在 Run Detail 中可见。"],
      "code_paths": ["services/api-server/app/agents", "services/api-server/app/agents/executor.py"],
      "spec_paths": ["docs/design/features/02-planner-executor.md", "docs/architecture/agent-runtime-spec.md"],
      "test_paths": ["services/api-server/tests/test_agents.py"],
      "evidence": [{"kind": "integration", "command": "services/api-server/.venv/bin/python -m pytest tests/test_agents.py", "result": "passed", "verified_at": "2026-08-17", "commit": null, "ref": "docs/development/ai/stages/07-private-deployable-harness-chain.md"}],
      "known_gaps": [],
      "task_ids": []
    },
    {
      "id": "executor",
      "parent_id": "plan-execution",
      "level": "feature",
      "name": "Executor 任务执行",
      "summary": "按计划执行模型、工具和子任务，并持久化终态。",
      "keywords": ["executor", "task execution", "执行器", "任务执行"],
      "platforms": ["api", "web"],
      "implementation_status": "verified",
      "maturity": "production_candidate",
      "acceptance_criteria": ["成功、失败、取消和暂停终态不会被迟到结果覆盖。"],
      "code_paths": ["services/api-server/app/agents/executor.py"],
      "spec_paths": ["docs/design/features/02-planner-executor.md", "docs/contracts/data-model-and-event-spec.md"],
      "test_paths": ["services/api-server/tests/test_agents.py", "services/api-server/tests/test_event_store.py"],
      "evidence": [{"kind": "integration", "command": "services/api-server/.venv/bin/python -m pytest tests/test_agents.py tests/test_event_store.py", "result": "passed", "verified_at": "2026-08-17", "commit": null, "ref": "omx_wiki/project-handoff-current-state.md"}],
      "known_gaps": [],
      "task_ids": []
    },
    {
      "id": "pause-resume-cancel",
      "parent_id": "plan-execution",
      "level": "feature",
      "name": "暂停、恢复与取消",
      "summary": "对运行中的 Agent Run 执行暂停、恢复和取消，并保持终态一致性。",
      "keywords": ["pause", "resume", "cancel", "stream abort", "暂停", "恢复", "取消"],
      "platforms": ["api", "web", "desktop"],
      "implementation_status": "verified",
      "maturity": "production_candidate",
      "acceptance_criteria": ["重复停止不会产生重复事件。", "流中止后终态和 replay 保持一致。"],
      "code_paths": ["services/api-server/app/agents", "services/api-server/app/events"],
      "spec_paths": ["docs/contracts/data-model-and-event-spec.md", "docs/design/console-ui-spec.md"],
      "test_paths": ["services/api-server/tests/test_agents.py", "services/api-server/tests/test_events_stream.py"],
      "evidence": [{"kind": "integration", "command": "services/api-server/.venv/bin/python -m pytest tests/test_agents.py tests/test_events_stream.py", "result": "passed", "verified_at": "2026-08-17", "commit": null, "ref": "omx_wiki/project-handoff-current-state.md"}],
      "known_gaps": [],
      "task_ids": []
    },
    {
      "id": "subagent-orchestration",
      "parent_id": "plan-execution",
      "level": "feature",
      "name": "Subagent 异步编排",
      "summary": "分派、运行和回收异步 Subagent 工作，并保留父子关联。",
      "keywords": ["subagent", "specialist", "fanout", "异步子代理", "专家"],
      "platforms": ["api", "web"],
      "implementation_status": "verified",
      "maturity": "production_candidate",
      "acceptance_criteria": ["父 Run、Assignment、Subagent Run 和结果可关联查询。"],
      "code_paths": ["services/api-server/app/teams", "services/api-server/app/agents"],
      "spec_paths": ["docs/design/features/04-subagent-orchestration.md", "docs/architecture/agent-runtime-spec.md"],
      "test_paths": ["services/api-server/tests/test_subagents.py", "services/api-server/tests/test_subagent_specialists.py"],